6,TYPE,FIELD,BITS,UNIT,CONVERSION,MODULE,MODULE_NUM,MODULE_LINE,LINE_TYPE,SHORT_NAME,DESCRIPTION
0,CAN,UW_ID,32,NONE,0,rc_eps_dist_4,1,1,0,ID,CAN ID with Length Encoded
1,CAN,com1_c_avg,16,raw node current,0,rc_eps_dist_4,1,2,0,com1_c_avg,COM1 domain current average,
2,CAN,com1_c_max,16,raw node current,0,rc_eps_dist_4,1,3,0,com1_c_max,COM1 domain current maximum,
3,CAN,com1_c_min,16,raw node current,0,rc_eps_dist_4,1,4,0,com1_c_min,COM1 domain current minimum,
4,CAN,com1_state,8,-,0,rc_eps_dist_4,1,5,0,com1_state,COM1 domain state,
5,CAN,JUNK,8,NONE,0,rc_eps_dist_4,1,6,0,Junk,Unexpected bytes at the end of the CAN Packet
