89,TYPE,FIELD,BITS,UNIT,CONVERSION,MODULE,MODULE_NUM,MODULE_LINE,LINE_TYPE,SHORT_NAME,DESCRIPTION
0,maxDownlink,inSafeMode,1,-,0,NONE,3,1,3,Safe Mode,Are we in safe mode?
1,maxDownlink,inHealthMode,1,-,0,NONE,3,2,3,Health Mode,Are we in health mode?
2,maxDownlink,transponderEnabled,1,-,0,NONE,3,3,3,Transponder,Is the transponder enabled
3,maxDownlink,inScienceMode,1,-,0,NONE,3,4,3,Science Mode,Are we in science mode?
4,maxDownlink,pad10,4,-,0,NONE,0,0,0,Pad10,Pad
5,maxDownlink,ReflectedPwr,8,mW,41,NONE,1,4,3,Ref Power,Reflected Power from the Transmit Antenna
6,maxDownlink,ICR3VProt,8,V,3,NONE,4,2,3,3V Prot,ICR 3V Proteted
7,maxDownlink,ICR2dot5V,8,V,2,NONE,4,3,3,2.5V,ICR 2.5V
8,maxDownlink,Xspin,16,dps,47,NONE,5,1,3,X Rotation,Angular Velocity around X Axis
9,maxDownlink,Yspin,16,dps,47,NONE,5,2,3,Y Rotation,Angular Veolcity around Y Axis
10,maxDownlink,Zspin,16,dps,47,NONE,5,3,3,Z Rotation,Angular Veolcity around Z Axis
11,maxDownlink,Xaccel,16,g,45,NONE,5,4,3,X Acceleration,Acceleration along X axis
12,maxDownlink,Yaccel,16,g,45,NONE,5,5,3,Y Acceleration,Acceleration along Y  axis
13,maxDownlink,Zaccel,16,g,45,NONE,5,6,3,Z Acceleration,Acceleration along Z axis
14,maxDownlink,Xmag,16,uT,46,NONE,5,7,3,X Magnetometer,Angular Veolcity around X Axis
15,maxDownlink,Ymag,16,uT,46,NONE,5,8,3,Y Magnetometer,Angular Veolcity around Y Axis
16,maxDownlink,Zmag,16,uT,46,NONE,5,9,3,Z Magnetometer,Angular Veolcity around Z Axis
17,maxDownlink,gTemp,16,C,48,NONE,5,10,3,Gyro Temp,Gyro temperature
18,maxDownlink,busV,8,V,2,NONE,6,1,3,Bus Voltage,Vbatt Bus voltage
19,maxDownlink,TxPAi,8,mA,10,NONE,1,1,3,PA Current,Transmit power amplifier current
20,maxDownlink,TxTemp,8,C,37,NONE,1,2,3,TX Temperature,Transmitter card temperature
21,maxDownlink,FwdPower,8,mW,40,NONE,1,3,3,Fwd Power,Receiver card temperature
22,maxDownlink,rssi,8,dBm,14,NONE,4,1,3,RSSI,Received Signal Strength Indication
23,maxDownlink,MinusYVolts,8,-,52,NONE,6,2,3,Minus Y Volts,Left (-Y) deployable panel Voltage
24,maxDownlink,MinusXVolts,8,-,52,NONE,6,3,3,Minus X Volts,Anti-sun Fixed Panel Voltage
25,maxDownlink,XVolts,8,-,52,NONE,6,4,3,Plus X Volts,Sun-side Fixed Panel Voltage
26,maxDownlink,YVolts,8,-,52,NONE,6,5,3,Plus Y Volts,Right (+Y) Deployable Panel Voltage
27,maxDownlink,MinusYTemp,8,-,52,NONE,6,6,3,Minus Y Temp,Left (-Y) deployable panel Voltage
28,maxDownlink,MinusXTemp,8,-,52,NONE,6,7,3,Minus X Temp,Anti-sun Fixed Panel Voltage
29,maxDownlink,XTemp,8,-,52,NONE,6,8,3,Plus X Temp,Sun-side Fixed Panel Voltage
30,maxDownlink,YTemp,8,-,52,NONE,6,9,3,Plus Y Temp,Right (+Y) Deployable Panel Voltage
31,maxDownlink,LtVGACtl,8,V,42,NONE,1,5,3,VGA Control,Control Voltage to the Variable Gain Amplifier (VGA)
32,maxDownlink,RT1Temp,8,-,0,NONE,7,1,3,Primary Temp,Primary RT-IHU Board Temp
33,maxDownlink,RT2Temp,8,-,0,NONE,7,2,3,RT-IHU Secondary Temp,Secondary RT-IHU Board Temp
34,maxDownlink,IHUcpuTemp,8,C,15,NONE,2,1,3,Temperature,Internal Temperature of IHU
35,maxDownlink,moduTemp,8,C,0,NONE,2,2,3,Modulator Temp,Internal Temperature of  the telemetry modulator
36,maxDownlink,CSS1,8,-,0,NONE,8,1,3,CSS #1,Coarse Sun Sensor Values
37,maxDownlink,CSS2,8,-,0,NONE,8,2,3,CSS #2,Coarse Sun Sensor Values
38,maxDownlink,CSS3,8,-,0,NONE,8,3,3,CSS #3,Coarse Sun Sensor Values
39,maxDownlink,CSS4,8,-,0,NONE,8,4,3,CSS #4,Coarse Sun Sensor Values
40,maxDownlink,CSS5,8,-,0,NONE,8,5,3,CSS #5,Coarse Sun Sensor Values
41,maxDownlink,CSS6,8,-,0,NONE,8,6,3,CSS #6,Coarse Sun Sensor Values
42,maxDownlink,CSS7,8,-,0,NONE,8,7,3,CSS #7,Coarse Sun Sensor Values
43,maxDownlink,CSS8,8,-,0,NONE,8,8,3,CSS #8,Coarse Sun Sensor Values
44,maxDownlink,CIU3V3_1,8,-,52,NONE,9,1,3,CIU 3.3V #1,3.3V Power for part 1 of CIU
45,maxDownlink,CIU3V3_2,8,-,0,NONE,9,2,3,CIU 3.3V #2,3.3V power for part 2 of CIU
46,maxDownlink,CIUVsys,8,-,0,NONE,9,3,3,CIU 6V Vsys,6V power on CIU aka Vsys
47,maxDownlink,CIU12v,8,-,0,NONE,9,4,3,CIU 12V Supply,12V Power From EPS
48,maxDownlink,Power10GHz,8,-,0,NONE,1,6,3,SSPA Power,Power output of the 10GHz SSPA
49,maxDownlink,pad11,8,-,0,NONE,0,0,3,Filler,Pad
50,maxDownlink,DeploySenseCan,8,-,0,NONE,1,7,3,Deploy Sense via CAN,TBD
51,maxDownlink,DeploySenseI2c,8,-,0,NONE,1,8,3,Deploy Sense via I2c,TBD
52,maxDownlink,PrimaryRTActive,1,-,0,NONE,7,3,3,Primary RTIHU,The Primary MCU on the RTIHU is in control of the RTIHU
53,maxDownlink,AutoSafeAllowed,1,-,1,NONE,3,5,3,Auto Safe Allowed,Autosafe Allowed
54,maxDownlink,AutoSafeModeActive,1,-,0,NONE,3,6,3,Auto Safe,Autosafe Mode Active
55,maxDownlink,I2CfailureSunSense,1,-,0,NONE,2,3,3,I2c CSS,Coarse Sun Sensor I2c failure
56,maxDownlink,I2CfailureSolarV,1,-,0,NONE,2,4,3,I2c Solar,Solar Voltage I2c failure
57,maxDownlink,pad12,1,-,0,NONE,2,5,3,Pad12,-
58,maxDownlink,I2CfailureICR,1,-,17,NONE,2,6,3,I2cICR,Antenna is not communicating over bus 2
59,maxDownlink,I2CFailureDeploy,1,-,17,NONE,2,7,3,I2c Deploy,Antenna is not communicating over bus 1
60,maxDownlink,TLMresets,8,-,1,NONE,2,8,3,Ground Resets,Number of times command stations reset stored telemetry
61,maxDownlink,wodSize,8,000s,1,NONE,3,7,3,WOD Stored,Number of WOD data payloads kept for each of Science and Housekeeping.  In hundreds
62,maxDownlink,swCmds,32,-,35,NONE,4,4,3,Diagnostic,ICR Diagnostic information
63,maxDownlink,hwCmdCnt,8,-,1,NONE,4,5,3,HW Command Count,Number of hardware commands since last reset
64,maxDownlink,swCmdCntICR,8,-,1,NONE,4,6,3,SW Command Count ICR,Number of software commands since last reset
65,maxDownlink,swCmdCntDCT,8,-,1,NONE,4,7,3,SW Command Count DCT,Number of software commands since last reset
66,maxDownlink,Pad3,8,-,0,NONE,0,0,0,Pad to replace RF switch,-
67,maxDownlink,CIUResetCnt1,8,-,0,NONE,9,5,3,CIU Reset Cnt,TBD
68,maxDownlink,CIUResetCnt2,8,-,0,NONE,9,6,3,CIU Reset Cnt,None
69,maxDownlink,DCT1Status,8,-,0,NONE,9,7,3,Primary DCT Status,TBD
70,maxDownlink,DCT2Status,8,-,0,NONE,9,8,3,Secondary DCT Status,TBD
71,maxDownlink,LMRAMstatus,8,-,0,NONE,0,0,3,LIHU MRAM Status,TBD
72,maxDownlink,PrimMRAMstatus,8,-,0,NONE,2,9,3,RT-IHU Primary MRAM Status,Status of the primary MRAM
73,maxDownlink,SecndMRAMstatus,8,-,0,NONE,2,10,3,RT-IHU Secondary MRAM Status,Status of the secondary MRAM
74,maxDownlink,ModuLO,8,-,0,NONE,2,11,3,Modulator Reg 0,Modulator Register 0
75,maxDownlink,ModuGain,8,-,0,NONE,2,12,3,Modulator Reg 1,Modulator Register 1
76,maxDownlink,ModuTemp,8,-,0,NONE,2,13,3,Modulator Reg 5,Modulator Register 5
77,maxDownlink,ModuMode,8,-,0,NONE,2,14,3,Modulator Reg 8,Modulator Register 8
78,maxDownlink,DCT1PwrCnt,8,-,0,NONE,2,15,3,Load Switch Flag Count,TBD
79,maxDownlink,DCT2PwrCnt,8,-,0,NONE,2,16,3,Load Switch Flag Count,TBD
80,maxDownlink,PA1PwrCnt,8,-,0,NONE,2,17,3,Load Switch Flag Count,TBD
81,maxDownlink,PA2PwrCnt,8,-,0,NONE,2,18,3,Load Switch Flag Count,TBD
82,maxDownlink,IHUhardError,32,-,19,NONE,2,19,3,IHU Hard Error Data,Reason for last reset
83,maxDownlink,IHUsoftError,32,-,20,NONE,3,8,3,Soft Error,Diagnostic Data on IHU Software Errors
84,maxDownlink,spare1,32,-,0,NONE,0,0,0,Spare,Diagnostic Data on IHU Performance
85,maxDownlink,maxTimestampUptime,32,s,1,Min Max,10,2,0,Max Uptime,Timestamp Resets
86,maxDownlink,maxTimestampReset,16,s,1,Min Max,10,1,0,Max Reset,Timestamp uptime
87,maxDownlink,maxCRCerror,8,-,0,Min Max,10,3,0,Max CRC Error,-
88,maxDownlink,pad0,8,-,0,NONE,0,0,0,Filler,Make same length as WOD
